{
  "id": "SEC-000001",
  "title": "6. Tiempo: relojes moleculares y desacuerdo con las rocas",
  "received_at": "2026-09-26",
  "original_content_path": "knowledge/corpus/sections/SEC-000001.md",
  "content_hash": "sha256:b9107c3a8e66f8fcd8e39c2198092b09e1b877b86c4cd14030029a85f20aeaad",
  "approximate_period": null,
  "topics": [],
  "source_ids": [],
  "schema_version": "1.2.0",
  "dataset_revision": "REV-000001",
  "record_status": "active"
}
