{
  "id": "SEC-000002",
  "title": "5. El registro material: fósiles y biomarcadores",
  "received_at": "2026-09-26",
  "original_content_path": "knowledge/corpus/sections/SEC-000002.md",
  "content_hash": "sha256:95cc030fcf06813b0377d45fcec8193365e6c6df2de8b9a6cac01370c212bf9e",
  "approximate_period": null,
  "topics": [],
  "source_ids": [],
  "schema_version": "1.3.0",
  "dataset_revision": "REV-000007",
  "record_status": "active"
}
