{
  "id": "SEC-000003",
  "title": "4. La raíz eucariota y la forma de Amorphea",
  "received_at": "2026-09-28",
  "original_content_path": "knowledge/corpus/sections/SEC-000003.md",
  "content_hash": "sha256:e85bf706b65fc472e73fbebee0cf9883d95774d52799b8547fa7a7c0460aaa8b",
  "approximate_period": null,
  "topics": [],
  "source_ids": [],
  "schema_version": "1.3.0",
  "dataset_revision": "REV-000009",
  "record_status": "active"
}
